"John McCarthy", "1958", "Invented #{Lisp}, a high-level programming language based on the #{lambda calculus}. Lisp became popular in the #{artificial intelligence} research and popularised many concepts in programming languages such as dynamic typing, linked lists, higher-order functions and recursion.", "Algorithms & Data Structures, Programming Languages", "Artificial Intelligence, Lisp", "5", "https://en.wikipedia.org/wiki/Lisp_(programming_language)"
"John McCarthy", "1959", "Invented a primitive method of #{garbage collection} to abstract away manual memory management in #{Lisp}. Garbage collection is a form of automatic memory management that attempts to free memory allocated to objects that are no longer in use in a running computer program.", "Algorithms & Data Structures, Programming Languages", "Lisp, Garbage Collection", "4", "https://en.wikipedia.org/wiki/Garbage_collection_(computer_science)"
"John McCarthy", "1959", "Served on the design committee for #{ALGOL} 60, an incredibly influential #{programming language} which introduced lexical scoping, code blocks and many syntactical elements common today (if, then, while, for, do, begin, end, etc).", "Algorithms & Data Structures, Programming Languages", "ALGOL", "4", "https://en.wikipedia.org/wiki/ALGOL_60"
"John McCarthy", "1961", "Proposed the idea of 'Utility Computing', a business model in which computing resources are supplied to customers on a by-demand basis. It would go on to inspire ideas in time-sharing models such as cloud computing.", "Algorithms & Data Structures, Publications", "Time-Sharing", "3", "https://en.wikipedia.org/wiki/Utility_computing"
"Marvin Minsky", "1951", "Invented Stochastic Neural-Analog Reinforcement Computer (SNARC), the first randomly wired #{neural network} learning machine. SNARC was based on reinforcing the synaptic connections that contributed to recent reactions.", "Algorithms & Data Structures, Robotics", "Artificial Intelligence, Neural Netwokrs", "2", "http://web.media.mit.edu/~minsky/minskybiog.html"
"Marvin Minsky", "1969", "Co-authored (with Seymour Papert) 'Perceptrons', a foundational study into artificial #{neural networks}. The book has caused much controversy as it's pessimistic predictions may have helped bring upon the 'AI winter' of the 1980's.", "Algorithms & Data Structures, Publications", "Artificial Intelligence, Neural Networks", "2", "https://en.wikipedia.org/wiki/Perceptrons_(book)"
"Marvin Minsky", "1972", "Co-invented the first #{Logo} turtle device, an educational robot that was capable of interpreting the #{Logo} programming language. The robots were capable of outputting results onto a peice of paper via a mounted pen.", "Algorithms & Data Structures, Robotics", "Logo", "2", "https://en.wikipedia.org/wiki/Turtle_(robot)"
"Peter Naur", "1959", "Served on the design committee for #{ALGOL} 60, an incredibly influential #{programming language} which introduced lexical scoping, code blocks and many syntactical elements common today (if, then, while, for, do, begin, end, etc).", "Algorithms & Data Structures, Programming Languages", "ALGOL", "4", "https://en.wikipedia.org/wiki/ALGOL_60"
"Peter Naur", "1963", "Extended the #{Backus-Naur Form} for use in #{ALGOL} 60. BNF is a notation for context-free grammars which is used to describe the syntax of #{programming languages|programming language}.", "Algorithms & Data Structures", "ALGOL, Backus-Naur Form, Backus Normal Form, Programming Language", "4", "https://en.wikipedia.org/wiki/Backus%E2%80%93Naur_Form"
"Max Newman", "1935", "Presented several lectures at Cambridge on #{logic} and Godel's #{incompleteness theorem}, which inspired Alan Turing to pursue pioneering work on the #{Entscheidungsproblem} using a #{hypothetical computing machine|Turing Machine}.", "Algorithms & Data Structures, Publications", "Entscheidungsproblem, Logic", "3", "https://en.wikipedia.org/wiki/Entscheidungsproblem"
"Max Newman", "1943", "Posed problems that would lead and influence the design of the #{Colossus} computer at Bletchley Park. Colossus, designed by Tommy Flowers, was the world's first programmable, electronic, digital computer.", "Algorithms & Data Structures, Early Computers", "Colossus, Bletchley Park", "3", "https://en.wikipedia.org/wiki/Colossus_computer"
"John von Neumann", "1945", "Invented #{Merge sort}, an efficient recursive sorting algorithm in which two halves of an array are sorted recursively and then merged.", "Algorithms & Data Structures", "Merge sort", "4", "https://en.wikipedia.org/wiki/Merge_sort"
"John von Neumann", "1950", "Made several contributions to random number generation, specifically his algorithm for 'fair coin' simulation, which are now implement in hardware random number generators. Neumann also contributed to the 'Monte Carlo method', although his approach is now seen as a historical curiosity more than a practical approach.", "Algorithms & Data Structures", "Random nuber generation", "2", "https://en.wikipedia.org/wiki/Monte_Carlo_method"
"John von Neumann", "1950", "Published the 'First draft of a report on the #{EDVAC}', an incomplete 101-page document which contains the first published description of the logical design of a computer using the #{stored-program|Stored-program Computer} concept. Although the concept of stored-program computers had already existed, the concept is now universally and controversially known as 'Von Neumann Architecture'.", "Algorithms & Data Structures, Publications", "Stored-program Computer, EDVAC", "4", "https://en.wikipedia.org/wiki/First_Draft_of_a_Report_on_the_EDVAC"
"John von Neumann", "1948", "Acted as consultant for several improvements made to the #{ENIAC} computer. These improvements reduced the speed of the ENIAC by a factor of six, but also reduced the reprogramming time to hours instead of days and so it was considered well worth the loss of performance.", "Algorithms & Data Structures, Early Computers", "ENIAC", "2", "https://en.wikipedia.org/wiki/ENIAC#Improvements"
"John von Neumann", "1949", "Along with Stanislaw Ulam, founded the field of #{Cellular automata} - self-replicating systems with a grid of cells that can be in a finite number of states. Cellular automata are commonly used to demonstrate the ability for complexity to arise from simple beginnings. His early work in this field is also considered by many to contain the world's first computer #{virus}.", "Algorithms & Data Structures", "Cellular automata", "3", "https://en.wikipedia.org/wiki/IAS_machine"
"John von Neumann", "1952", "Designed the 'IAS Machine', an early binary, electronic #{stored-program computer}. It was one of the first stored-program computers in operation in the USA.", "Algorithms & Data Structures, Early Computers", "IAS Machine, Stored-program Computer", "2", "https://en.wikipedia.org/wiki/IAS_machine"
"Kristen Nygaard", "1962", "Invented #{Simula I|Simula} (with Ole-Johan Dahl) as a superset of #{ALGOL 60|ALGOL} for simulating discrete event systems.", "Algorithms & Data Structures, Programming Languages", "Object-Oriented Programming, Simula, ALGOL", "4", "https://en.wikipedia.org/wiki/Simula"
"Kristen Nygaard", "1967", "Published #{Simula 67|Simula} (with Ole-Johan Dahl), an updated version of #{Simula I|Simula}. Simula 67 is considered the first #{object-oriented programming} language as it introduced many OO concepts such as objects, classes, subclasses and inheritance.", "Algorithms & Data Structures", "Object-Oriented Programming, Simula, ALGOL", "5", "https://en.wikipedia.org/wiki/Simula"
"James Cooley", "1965", "Along with John W. Tukey, (re)invented and popularized a #{Fast Fourier transform} (FFT) algorithm. FFT's are widely used for many applications in engineering, science, and mathematics.", "Algorithms & Data Structures", "Fast Fourier transform", "3", "https://en.wikipedia.org/wiki/Cooley%E2%80%93Tukey_FFT_algorithm"
"John W. Tukey", "1945", "Coined the term 'bit' as a contraction of the term 'binary digit'. A bit is the most basic unit of information in computer systems.", "Algorithms & Data Structures", "Bit", "2", "http://www.linfo.org/bit.html"
"John W. Tukey", "1957", "Coined the term 'software' in his paper 'The Teaching of Concrete Mathematics'. Although it is claimed the term already existed since atleast 1953, Tukey's paper is the earliest known publication containing it.", "Algorithms & Data Structures", "Software", "2", "https://en.wikipedia.org/wiki/Software"
"John W. Tukey", "1965", "Along with James Cooley, (re)invented and popularized a #{Fast Fourier transform} (FFT) algorithm. FFT's are widely used for many applications in engineering, science, and mathematics.", "Algorithms & Data Structures", "Fast Fourier transform", "3", "https://en.wikipedia.org/wiki/Cooley%E2%80%93Tukey_FFT_algorithm"
"Blaise Pascal", "1642", "Whilst still a teenager, invented the #{mechanical calculator} (AKA Pascaline), a device for automatically performing the basic operations of arithmatic. This would go on to influence future efforts like Babbage's #{difference engine}.", "Algorithms & Data Structures, Early Computers", "Mechanical Calculator", "5", "https://en.wikipedia.org/wiki/Mechanical_calculator"
"Emil Leon Post", "1936", "Developed, independently of Alan #{Turing|Turing Machine}, a mathematical model of computation that he called 'Formulation 1', although it is now known as the #{Post-Turing Machine}.", "Algorithms & Data Structures, Early Computers", "Mechanical Calculator", "5", "https://en.wikipedia.org/wiki/Post%E2%80%93Turing_machine"
"Emil Leon Post", "1943", "Published the 'Post Canonical Systen', a #{Turing-complete|Turing-Completeness} string-manipulation system that can generate formal languages. This helped formalise many ideas used in programming language grammars today.", "Algorithms & Data Structures, Publications", "Formal Grammar", "4", "https://en.wikipedia.org/wiki/Post_canonical_system"
"Emil Leon Post", "1946", "Posed the 'Post correspondence problem', an undecidable decision-problem that is simpler than the #{halting problem} and the #{Entscheidungsproblem}. An undecidable problem is one for which there is no known algorithm that always leads to a correct answer.", "Algorithms & Data Structures, Publications", "Formal Grammar", "4", "https://en.wikipedia.org/wiki/Post_correspondence_problem"
"Dennis Ritchie", "1969", "Along with Ken Thompson, developed the first version of #{Unix}, a multitasking operating system. Unix, hailed as a hallmark of beautiful software design, is still in use by millions of users today.", "Algorithms & Data Structures, Operating Systems", "Unix", "5", "https://en.wikipedia.org/wiki/Unix"
"Dennis Ritchie", "1972", "Developed the first version of #{C} - a high-level, imperative programming language - on a #{PDP-11|PDP} minicomputer. C has since become one of the most well-known programming languages of all time.", "Algorithms & Data Structures, Programming Languages", "C", "5", "https://en.wikipedia.org/wiki/C_(programming_language)"
"Dennis Ritchie", "1978", "Co-authored the book 'The C Programming Language', also known as simply K&R. It quickly became the de facto standard for C programming and has since, because of it's clear and concise style, become a model for technical writing.", "Algorithms & Data Structures, Publications", "C", "4", "https://en.wikipedia.org/wiki/The_C_Programming_Language"
"Ken Thompson", "1968", "Wrote a version of the QED text editor that allowed users to search text using regular expressions. This was the first text editor with such functionality.", "Algorithms & Data Structures", "Text editors, Regular Expressions", "3", "https://en.wikipedia.org/wiki/QED_(text_editor)"
"Ken Thompson", "1968", "Developed 'Thompson's Construction Algorithm' used for converting regular expression into nondeterministic finite automaton, which allowed for faster expression matching.", "Algorithms & Data Structures", "Regular Expressions", "2", "https://en.wikipedia.org/wiki/Thompson%27s_construction"
"Ken Thompson", "1969", "Along with Dennis Ritchie, developed the first version of #{Unix}, a multitasking operating system. Unix, hailed as a hallmark of beautiful software design, is still in use by millions of users today.", "Algorithms & Data Structures, Operating Systems", "Unix", "5", "https://en.wikipedia.org/wiki/Unix"
"Ken Thompson", "1969", "Created #{B}, a low-level imperative untyped programming language, for use on the #{Unix} operating system. B was the pre-decessor to #{C}. B is notable for introducing the increment and decrement shortcuts such as '++', '-=', '+=', etc.", "Algorithms & Data Structures, Programming Languages", "B", "2", "https://en.wikipedia.org/wiki/C_(programming_language)"
"Ken Thompson", "1992", "Along with Rob Pike, created the #{UTF-8} encoding scheme. UTF-8 supports all code-points of the Unicode character set and is the dominant encoding scheme on the #{World Wide Web} accounting for billions of web pages.", "Algorithms & Data Structures", "UTF-8", "3", "https://en.wikipedia.org/wiki/UTF-8"
"Ken Thompson", "2007", "Along with Robert Griesemer and Rob Pike, designed the #{Go} programming language. Go was motivated by the designers shared disliking of the complexity of #{C++}. Go is compiled, statically-typed and uses an #{ALGOL}-like syntax.", "Algorithms & Data Structures, Programming Languages", "Go", "3", "https://en.wikipedia.org/wiki/Go_(programming_language)"
"Saul Rosen", "1957", "Designed the software (including a #{FORTRAN} compiler) for the first fully-commercial transistorized computer; the Philco Transac S-2000.", "Algorithms & Data Structures, Early Computers", "FORTRAN, Transistor", "4", "https://www.rcac.purdue.edu/about/saul-rosen/"
"Bertrand Russell", "1908", "Introduced the notion of #{Type theory} in an attempt to avoid paradoxes found in many formal systems of logic and rewrite systems. Type theory is closely ralated to #{type systems}, which are features of programming languages to help reduce bugs and provide rigidity to programs.", "Algorithms & Data Structures, Foundations", "Type theory, Type systems, Formal languages", "4", "https://en.wikipedia.org/wiki/Type_theory"
"Bertrand Russell", "1910", "Along with Alfred North Whitehead, introduced the notion of a #{Type system} in their seminal work on mathematical logic: Principia Mathematica.", "Algorithms & Data Structures, Foundations", "Type theory, Type systems", "4", "https://en.wikipedia.org/wiki/Principia_Mathematica"
